Topic,SubTopic,Difficulty,Frequency,ImportanceWeight,ExpectedQuestionCount,AverageTime,PrerequisiteConcepts,LearningOrder,ProgrammingLanguage
Data Structures,Arrays and strings,Medium,High,9,1,110,array manipulation; string processing,1,Java/Python/C++
Algorithms,Sorting and searching,Medium,High,8,1,120,algorithm fundamentals; complexity analysis,2,Java/Python/C++
Algorithms,Dynamic programming,Hard,High,9,1,150,recursion; memoization; state definition,3,Java/Python/C++
Data Structures,Linked lists and pointer logic,Medium,Medium,7,1,120,node manipulation; list traversal,4,Java/Python/C++
Algorithms,Greedy algorithms,Medium,Medium,7,1,120,optimal substructure; heuristic design,5,Java/Python/C++
Data Structures,Trees and binary search trees,Hard,Medium,8,1,140,tree traversal; recursion,6,Java/Python/C++
Algorithms,Graph traversal and shortest path,Hard,Medium,8,1,150,breadth-first search; depth-first search,7,Java/Python/C++
Software Design,Object-oriented design and modular coding,Medium,Low,7,1,130,class design; data encapsulation,8,Java/Python/C++
